{
  "$schema": "http://json-schema.org/draft-07/schema#",
  "title": "DeductiveThought",
  "type": "object",
  "required": [
    "mode",
    "premises",
    "conclusion",
    "validityCheck"
  ],
  "properties": {
    "mode": {
      "const": "deductive"
    },
    "premises": {
      "type": "array",
      "minItems": 1,
      "items": {
        "type": "string"
      }
    },
    "conclusion": {
      "type": "string",
      "minLength": 1
    },
    "logicForm": {
      "type": [
        "string",
        "null"
      ]
    },
    "derivationSteps": {
      "type": "array",
      "description": "Optional: intermediate inference steps connecting premises to conclusion. Use for multi-step proofs where a single-jump conclusion would obscure the reasoning. Omit or leave empty for one-step conclusions. Added in v0.5.2 as Enrichment 1 of the core-triad schema enrichment proposal (see docs/ROADMAP).",
      "items": {
        "type": "object",
        "required": [
          "stepNumber",
          "intermediateConclusion",
          "inferenceRule"
        ],
        "properties": {
          "stepNumber": {
            "type": "integer",
            "minimum": 1,
            "description": "1-indexed position of this step in the derivation chain. Step numbers should be sequential and unique within derivationSteps[]."
          },
          "premisesUsed": {
            "type": "array",
            "items": {
              "type": "integer",
              "minimum": 0
            },
            "description": "0-indexed references into the top-level premises[] array. May be empty if this step derives only from prior steps."
          },
          "stepsUsed": {
            "type": "array",
            "items": {
              "type": "integer",
              "minimum": 1
            },
            "description": "References to prior stepNumber values. Each referenced step must appear earlier in derivationSteps[] — no forward references."
          },
          "intermediateConclusion": {
            "type": "string",
            "minLength": 1,
            "description": "The fact or claim derived at this step. The last step's intermediateConclusion should match (or closely match) the top-level conclusion."
          },
          "inferenceRule": {
            "type": "string",
            "minLength": 1,
            "description": "Name of the classical inference rule applied at this step (e.g., 'modus ponens', 'modus tollens', 'hypothetical syllogism', 'disjunctive syllogism', 'universal instantiation', 'reductio ad absurdum'). Free-text in v0.5.2; may become an enum in a future release."
          }
        },
        "additionalProperties": false
      }
    },
    "validityCheck": {
      "type": "boolean"
    },
    "soundnessCheck": {
      "type": [
        "boolean",
        "null"
      ]
    }
  },
  "additionalProperties": false
}