{
  "mode": "deductive",
  "premises": [
    "Any request that fails authentication must be logged to the audit trail",
    "Any audit-trail entry must trigger an alert",
    "Request R failed authentication"
  ],
  "conclusion": "Request R must trigger an alert",
  "logicForm": "repeated modus ponens",
  "derivationSteps": [
    {
      "stepNumber": 1,
      "premisesUsed": [0, 2],
      "stepsUsed": [],
      "intermediateConclusion": "Request R must be logged to the audit trail",
      "inferenceRule": "modus ponens"
    },
    {
      "stepNumber": 2,
      "premisesUsed": [1],
      "stepsUsed": [1],
      "intermediateConclusion": "Request R must trigger an alert",
      "inferenceRule": "modus ponens"
    }
  ],
  "validityCheck": true,
  "soundnessCheck": true
}
